{
  "version": "6.0-claude-native",
  "client": "Hilmar Ingredients",
  "contact": "Lonny Upfold",
  "provider": "OL-USA",
  "date_range": "2026-04-01 to 2026-04-15",
  "last_updated": "2026-04-15T17:30:00Z",
  "requests": [
    {
      "request_id": "fixture-win-001",
      "request_date": "2026-04-02",
      "request_timestamp": "2026-04-02T14:05:00Z",
      "subject": "Ocean rate request \u00e2\u20ac\u201d Oakland \u00e2\u2020\u2019 Shanghai",
      "origin": "Oakland, CA",
      "destination": "Shanghai, CN",
      "lane": "Oakland \u00e2\u2020\u2019 Shanghai",
      "containers": "3\u00c3\u201440'RF",
      "container_count": 3,
      "teu_requested": 6,
      "product": "Dairy",
      "temperature": "-18C",
      "requested_dates": "ETD 2026-04-10",
      "eta_requested": "2026-04-28",
      "response_timestamp": "2026-04-02T17:45:00Z",
      "ol_responder": "MBD Ocean Export Booking",
      "quoted": true,
      "carrier_quoted": "MSC",
      "ol_rate": 4250.0,
      "etd_offered": "2026-04-11",
      "eta_offered": "2026-04-29",
      "transshipment": "None",
      "erd": "2026-04-08",
      "doc_cutoff": "2026-04-09",
      "port_cutoff": "2026-04-10",
      "origin_free_time": "5 days",
      "dest_free_time": "7 days",
      "turnaround_hours": 3.67,
      "turnaround_biz_hours": 3.67,
      "after_hours_request": false,
      "status": "WIN",
      "has_send": true,
      "carrier_won": "MSC",
      "teu_won": 6,
      "mdolx_ref": "MDOLX-A1",
      "mdolx_date": "2026-04-03",
      "loss_reason": null,
      "etd_fit_days": 1,
      "conversation_id": "CONV-001",
      "status_history": []
    },
    {
      "request_id": "fixture-win-002",
      "request_date": "2026-04-05",
      "request_timestamp": "2026-04-05T15:00:00Z",
      "origin": "Long Beach, CA",
      "destination": "Yokohama, JP",
      "lane": "Long Beach \u00e2\u2020\u2019 Yokohama",
      "containers": "2\u00c3\u201440'RF",
      "container_count": 2,
      "teu_requested": 4,
      "response_timestamp": "2026-04-05T18:30:00Z",
      "ol_responder": "MBD Ocean Export Booking",
      "quoted": true,
      "carrier_quoted": "MSC",
      "ol_rate": 3900.0,
      "etd_offered": "2026-04-14",
      "turnaround_biz_hours": 3.5,
      "status": "WIN",
      "has_send": true,
      "carrier_won": "MSC",
      "teu_won": 4,
      "mdolx_ref": "MDOLX-A2",
      "loss_reason": null,
      "etd_fit_days": 0,
      "conversation_id": "CONV-002",
      "subject": "Ocean rate request \u2014 Long Beach, CA -> Yokohama, JP",
      "status_history": []
    },
    {
      "request_id": "fixture-ql-001",
      "request_date": "2026-04-06",
      "request_timestamp": "2026-04-06T13:10:00Z",
      "origin": "Oakland, CA",
      "destination": "Busan, KR",
      "lane": "Oakland \u00e2\u2020\u2019 Busan",
      "containers": "4\u00c3\u201440'RF",
      "container_count": 4,
      "teu_requested": 8,
      "response_timestamp": "2026-04-06T19:45:00Z",
      "ol_responder": "MBD Export Pricing",
      "quoted": true,
      "carrier_quoted": "Maersk",
      "ol_rate": 4600.0,
      "etd_offered": "2026-04-18",
      "turnaround_biz_hours": 6.58,
      "status": "Q&L",
      "has_send": false,
      "carrier_won": null,
      "teu_won": 0,
      "mdolx_ref": null,
      "loss_reason": "PRICE",
      "etd_fit_days": 3,
      "conversation_id": "CONV-003",
      "subject": "Ocean rate request \u2014 Oakland, CA -> Busan, KR",
      "status_history": []
    },
    {
      "request_id": "fixture-nq-001",
      "request_date": "2026-04-08",
      "request_timestamp": "2026-04-08T21:20:00Z",
      "origin": "Tacoma, WA",
      "destination": "Qingdao, CN",
      "lane": "Tacoma \u00e2\u2020\u2019 Qingdao",
      "containers": "5\u00c3\u201440'RF",
      "container_count": 5,
      "teu_requested": 10,
      "response_timestamp": null,
      "ol_responder": null,
      "quoted": false,
      "carrier_quoted": null,
      "ol_rate": null,
      "turnaround_biz_hours": null,
      "after_hours_request": true,
      "status": "NQ",
      "has_send": false,
      "carrier_won": null,
      "teu_won": 0,
      "mdolx_ref": null,
      "loss_reason": "NO_RESPONSE",
      "etd_fit_days": null,
      "conversation_id": "CONV-004",
      "subject": "Ocean rate request \u2014 Tacoma, WA -> Qingdao, CN",
      "status_history": []
    },
    {
      "request_id": "fixture-pending-001",
      "request_date": "2026-04-14",
      "request_timestamp": "2026-04-14T16:00:00Z",
      "origin": "Oakland, CA",
      "destination": "Shanghai, CN",
      "lane": "Oakland \u00e2\u2020\u2019 Shanghai",
      "containers": "3\u00c3\u201440'RF",
      "container_count": 3,
      "teu_requested": 6,
      "response_timestamp": "2026-04-14T20:15:00Z",
      "ol_responder": "MBD Ocean Export Booking",
      "quoted": true,
      "carrier_quoted": "MSC",
      "ol_rate": 4350.0,
      "etd_offered": "2026-04-22",
      "turnaround_biz_hours": 4.25,
      "status": "PENDING",
      "has_send": false,
      "carrier_won": null,
      "teu_won": 0,
      "mdolx_ref": null,
      "loss_reason": null,
      "etd_fit_days": 1,
      "conversation_id": "CONV-005",
      "subject": "Ocean rate request \u2014 Oakland, CA -> Shanghai, CN",
      "status_history": []
    }
  ],
  "summary": {
    "total_entries": 5,
    "wins": 2,
    "quoted_lost": 1,
    "not_quoted": 1,
    "pending_hilmar": 1,
    "win_rate": 50.0,
    "quote_rate": 80.0,
    "teu_won": 10,
    "teu_requested": 34,
    "teu_quoted_lost": 8,
    "teu_not_quoted": 10,
    "teu_pending": 6,
    "turnaround_entries": 4,
    "turnaround_avg_biz_hours": 4.5,
    "turnaround_avg_clock_hours": 4.5,
    "dod": {}
  },
  "lanes": [],
  "carriers": []
}